<?xml version="1.0" encoding="UTF-8" standalone="no"?>
<!DOCTYPE StringTable SYSTEM "XStringTable.dtd">

<StringTable date = "3/17/2001" time = "1:08 AM">
	<Entry file = "CAppMenuHandler.cpp">
		<Original>A 4D fractal renderer written using the Whisper framework. Jesse Jones (c) 2000</Original>
	</Entry>

	<Entry file = "CBailoutDialog.cpp">
		<Original>Change Bailout</Original>
	</Entry>

	<Entry file = "CPointLightDialog.cpp">
		<Original>Change Light</Original>
	</Entry>

	<Entry file = "MMain.cpp WMain.cpp">
		<Original>Couldn't initialize the application.</Original>
	</Entry>

	<Entry file = "CAppMenuHandler.cpp">
		<Original>HyperMandella 1.0</Original>
	</Entry>

	<Entry file = "MMain.cpp">
		<Original>HyperMandella Prefs</Original>
	</Entry>

	<Entry file = "CInitMenuBar.cpp">
		<Original>Palette</Original>
	</Entry>

	<Entry file = "WMain.cpp">
		<Original>SOFTWARE\\Whisper\\HyperMandella\\1.0</Original>
	</Entry>

	<Entry file = "CDocMenuHandler.cpp">
		<Original>Set Palette</Original>
	</Entry>

</StringTable>
